{
  "schemaVersion": 1,
  "principles": [
    "canonical-resources",
    "explicit-authority",
    "source-review-separation",
    "honest-execution-mode",
    "quiet-operation",
    "record-driven-extension"
  ],
  "capabilities": [
    {
      "key": "workspace",
      "purpose": "Find PPG work, reference material and operational status",
      "lifecycle": "pilot",
      "executionMode": "native-interactive",
      "responsibleRole": "Workbench operator",
      "resources": [
        "hub",
        "status",
        "evidence",
        "workspace-status-flow"
      ],
      "dependencies": [
        "catalogue",
        "review-workflow",
        "source-sync",
        "captured-archive",
        "monthly-reporting"
      ],
      "acceptanceCriteria": [
        "Native resource readback",
        "No inferred business approval",
        "Existing access preserved"
      ]
    },
    {
      "key": "catalogue",
      "purpose": "Read source register with persistent identities and provenance",
      "lifecycle": "live",
      "executionMode": "native-interactive",
      "responsibleRole": "Workbench operator",
      "resources": [
        "catalogue"
      ],
      "dependencies": [],
      "acceptanceCriteria": [
        "Native resource readback",
        "No inferred business approval",
        "Existing access preserved"
      ]
    },
    {
      "key": "review-workflow",
      "purpose": "Prepare editable DRAFT packages for later responsible review",
      "lifecycle": "live",
      "executionMode": "local-manual",
      "responsibleRole": "Workbench operator",
      "resources": [
        "queue",
        "template",
        "operator-guide",
        "review-standards-registers",
        "review-role-registers",
        "review-content-register",
        "review-annotation-register",
        "review-criteria-registers",
        "review-prompt-kit",
        "review-historical-pack",
        "review-web-word-revision",
        "review-role-web-flow",
        "review-standards-web-flow",
        "review-role-script",
        "review-standards-script",
        "review-runtime-hosts",
        "review-intelligence-guides",
        "change-impact-register",
        "doctor-guide-draft",
        "change-impact-summary",
        "review-web-reconciliation-flow"
      ],
      "dependencies": [],
      "acceptanceCriteria": [
        "Native resource readback",
        "No inferred business approval",
        "Existing access preserved"
      ]
    },
    {
      "key": "source-sync",
      "purpose": "Refresh source fields without changing local review work",
      "lifecycle": "live",
      "executionMode": "native-scheduled",
      "responsibleRole": "Workbench operator",
      "resources": [
        "source-sync-evidence",
        "source-importer-flow"
      ],
      "dependencies": [],
      "acceptanceCriteria": [
        "Native resource readback",
        "No inferred business approval",
        "Existing access preserved"
      ]
    },
    {
      "key": "captured-archive",
      "purpose": "Find preserved captured sources without implying current authority",
      "lifecycle": "live",
      "executionMode": "native-interactive",
      "responsibleRole": "Workbench operator",
      "resources": [
        "archive"
      ],
      "dependencies": [],
      "acceptanceCriteria": [
        "Native resource readback",
        "No inferred business approval",
        "Existing access preserved"
      ]
    },
    {
      "key": "monthly-reporting",
      "purpose": "Prepare monthly due/overdue working reports from the last verified catalogue, with explicit freshness warnings",
      "lifecycle": "live",
      "executionMode": "native-scheduled",
      "responsibleRole": "Workbench operator",
      "resources": [
        "monthly-reports",
        "monthly-report-flow"
      ],
      "dependencies": [
        "catalogue",
        "source-sync"
      ],
      "acceptanceCriteria": [
        "Existing report flow and output readback verified",
        "No automatic distribution",
        "Source freshness warning retained"
      ]
    },
    {
      "key": "submission-assembly",
      "purpose": "Assemble a draft submission ZIP, attachment index and missing-items report",
      "lifecycle": "live",
      "executionMode": "local-manual",
      "responsibleRole": "Custodian / coordinator preparing a submission",
      "resources": [
        "submission-assembler",
        "submission-guide",
        "submission-example"
      ],
      "dependencies": [
        "review-workflow"
      ],
      "acceptanceCriteria": [
        "Hosted bytes match maintained tool",
        "Browser-generated ZIP preserves original attachments",
        "Missing evidence stays visible and human checks remain required",
        "No source/case updates or automatic submission"
      ]
    },
    {
      "key": "metadata-prefilling",
      "purpose": "Prefill recorded metadata and check the existing review template structure",
      "lifecycle": "live",
      "executionMode": "local-manual",
      "responsibleRole": "Workbench operator",
      "resources": [
        "submission-assembler",
        "metadata-prefill-guide",
        "metadata-prefill-example"
      ],
      "dependencies": [
        "submission-assembly"
      ],
      "acceptanceCriteria": [
        "Conflicting local metadata preserved",
        "Blank human decision fields",
        "Actual downloaded tool and ZIP readback",
        "Structural pass does not imply content review"
      ]
    },
    {
      "key": "evidence-navigation",
      "purpose": "Find captured references, the DRAFT example package, reusable template and source-sync evidence",
      "lifecycle": "live",
      "executionMode": "native-interactive",
      "responsibleRole": "Workbench operator",
      "resources": [
        "archive",
        "submission-example",
        "template",
        "archive-index",
        "source-sync-evidence-view"
      ],
      "dependencies": [
        "workspace",
        "captured-archive",
        "review-workflow",
        "submission-assembly",
        "source-sync"
      ],
      "acceptanceCriteria": [
        "Four tasks reachable from Start Here through canonical resources",
        "Archive all-files and CMO subset preserved",
        "Search gaps exposed with verified index/download fallback",
        "Native save/readback and repeat-safe navigation; no new tabs or permissions"
      ]
    },
    {
      "key": "identity-triage",
      "purpose": "Prepare evidenced alias/new-UID decisions and explicit source-absence acknowledgements; apply through the sole guarded importer while retaining absent records unchanged",
      "lifecycle": "live",
      "executionMode": "native-scheduled",
      "responsibleRole": "Source-sync operator records identity decisions; existing sole importer applies accepted packages",
      "resources": [
        "identity-triage-tool",
        "identity-triage-example",
        "identity-operator-guide",
        "identity-application-control",
        "identity-application-builder"
      ],
      "dependencies": [
        "source-sync",
        "workspace"
      ],
      "acceptanceCriteria": [
        "Current source/contract fingerprints, exact aliases, explicit decisions and new-UID authorisation are checked before writes",
        "Native existing-UID continuity, authorised creation, failure/checkpoint recovery, zero-write replay and preserved local edits verified",
        "Stale-source/contract and UID-collision packages rejected before native writes",
        "Active identity contract is committed with the success checkpoint; missing source rows never trigger retirement",
        "No source-register, case, clinical-review, permission or notification changes",
        "Source-bound retained absences require explicit authority; active-source and total catalogue identity sets remain distinct",
        "17 October real-source recovery and committed-package replay verified complete readback, unchanged retained-item values/ETags and zero repeated writes",
        "Normal hourly configuration restored and metadata-only execution verified; other consumers require separate retained-absence compatibility qualification"
      ]
    },
    {
      "key": "human-readiness",
      "purpose": "Record human findings for an exact case/document/version without performing assessment or approval",
      "lifecycle": "live",
      "executionMode": "native-interactive",
      "responsibleRole": "Operator records actual assessor and evidence; substantive finding remains human",
      "resources": [
        "human-readiness-events",
        "human-readiness-guide"
      ],
      "dependencies": [
        "workspace",
        "review-workflow"
      ],
      "acceptanceCriteria": [
        "Native form save/reopen and prior versions verified",
        "Repeated findings retained and later document version not automatically assessed",
        "Required evidence and repeat-safe schema/views verified",
        "Existing cases, permissions and business decisions preserved"
      ]
    },
    {
      "key": "assurance-readiness",
      "purpose": "Record version-specific decisions, conditions and publication/implementation/verification evidence; optional local validation never performs those actions",
      "lifecycle": "live",
      "executionMode": "native-interactive",
      "responsibleRole": "Operator records actual decision/action actors and evidence; existing roles and authority remain",
      "resources": [
        "assurance-events",
        "assurance-guide",
        "assurance-validator",
        "assurance-missing-evidence-view",
        "assurance-conditions-view",
        "assurance-publication-view",
        "assurance-implementation-view",
        "assurance-verification-view",
        "assurance-decision-history-view"
      ],
      "dependencies": [
        "workspace",
        "review-workflow",
        "human-readiness",